BookID,Title,Authors,Category,Price,Quantity
662,Alistair Cooke's America,"By Cooke, Alistair"," History , United States , General",7.06,4.0
663,The Purpose Driven Life Journal,"By Warren, Rick",,4.99,4.0
664,Going Bridal: How to Get Married Without Losing Your Mind,"By Robbins, Li"," Reference , Weddings",5.29,4.0
665,Incidents in the Life of a Slave Girl,"By Jacobs, Harriet, Child, Lydia Maria Francis, and Brent, L."," Biography & Autobiography , Cultural Heritage",5.29,4.0
666,Human Resource Management,"By Mathis, Robert L. and Jackson, John H.",,7.62,4.0
667,Plumage,"By Springer, Nancy"," Fiction , General",5.37,4.0
668,The Fundamentals of Play: A Novel,"By Macy, Caitlin"," Fiction , Urban",5.29,4.0
669,Improvised Europeans: American Literary Expatriates In London,"By Zwerdling, Alex"," Literary Criticism , American , General",5.7,4.0
670,Forever Beautiful With Rex: Makeup Strategies for the Rest of Your Life,"By Jewell, Diana Lewis, Rex (ILT), and Rex",,6.0,4.0
671,"Best Places to Stay in the Caribbean, Sixth Edition","By Jamison, Cheryl Alters, Jamison, Bill, and Shaw, Bruce"," Travel , Caribbean & West Indies",4.99,4.0
672,Solve Your Child's Sleep Problems,"By Ferber, Richard"," Family & Relationships , Parenting , General",4.99,4.0
673,All Japan: The Catalogue of Everything Japanese,"By Dalby, Liza",,10.99,4.0
674,The World Of Biblical Literature,"By Alter, Robert"," Religion , General",5.29,4.0
675,Geography and Development: A World Regional Approach,By FISHER,,7.74,4.0
676,Dissection of the Fetal Pig,"By Walker, Warren F.",,5.29,4.0
677,Search for Spring,"By Miller, Moira and Deuchar, Ian (ILT)",,4.99,4.0
678,Death bed: A detective story,"By Greenleaf, Stephen",,5.29,4.0
679,Caring and Coping When Your Loved One is Seriously Ill,"By Grollman, Earl A."," Self-help , Personal Growth , General",5.29,4.0
680,Voice Lessons: On Becoming a (Woman) Writer,"By Mairs, Nancy"," Literary Criticism , General",5.29,4.0
681,The New Face of Terrorism: Threats from Weapons of Mass Destruction,"By Cole, Benjamin and Gurr, Nadine"," Social Science , Criminology",5.29,4.0
682,"The Rich Are Different: A Priceless Treasury of Quotations and Anecdotes About the Affluent, the Posh, a nd the Just Plain Loaded","By Winokur, Jon (EDT)"," Humor , Form , Parodies",5.29,4.0
683,Mensa Presents Number Puzzles for Math Geniuses: 200 Fiendish and Intriguing Mind Games,"By Gale, Harold"," Games , Puzzles",5.29,4.0
684,Nine Innings,"By Okrent, Daniel"," Sports & Recreation , Baseball , Essays & Writings",4.99,4.0
685,Real Lace: America's Irish Rich,"By Birmingham, Stephen",,8.79,4.0
686,Call To Home: African Americans Reclaim The Rural South,"By Stack, Carol B."," Social Science , Ethnic Studies , African American Studies",5.29,4.0
687,The Ordinary Seaman,"By Goldman, Francisco and Golman, Francisco"," Fiction , General",4.99,4.0
688,"Taking on the World: Joseph and Stewart Alsop, Guardians of the American Century","By Merry, Robert W."," Biography & Autobiography , General",4.99,4.0
689,"Born to Rebel: Birth Order, Family Dynamics, and Creative Lives","By Sulloway, Frank J."," Psychology , Applied Psychology",8.79,4.0
690,The Monitor Chronicles : One Sailor's Account : Today's Campaign to Recover the Civil War Wreck,"By Mariners' Museum (Newport News, Va.) (COR), Geer, George S. (EDT), and Marvel, William (EDT)"," History , Military , Naval",19.7,4.0
691,Fire in My Soul,"By Lester, Joan Steinau and Norton, Eleanor Holmes"," Biography & Autobiography , Political",5.53,3.0
692,Maryland Wits and Baltimore Bards: A Literary History with Notes on Washington Writers (Maryland Paperback Bookshelf),"By Shivers, Frank R."," History , United States , State & Local , Middle Atlantic (DC, DE, MD, NJ, NY, PA)",4.99,3.0
693,War Babies,"By Busch, Frederick"," Comics & Graphic Novels , General",4.99,3.0
694,How to Plant and Grow Annuals (How to Plant and Grow Series),"By Reilly, Ann",,4.99,3.0
695,A Skeleton in God's Closet,"By Maier, Paul L."," Fiction , Religious",4.99,3.0
696,Words & Quilts: A Selection of Quilt Poems,"By Mitchell, Felicia (EDT)"," Poetry , General",5.41,3.0
697,Home beermaking: The complete beginner's guidebook,"By Moore, William",,4.99,3.0
698,"We Should Be So Lucky : Love, Sex, Food, and Fun After Forty from the Diva of QVC","By Levine, Kathy, Scovell, Jane, and Appleton, Amy Sarah"," Family & Relationships , General",5.29,3.0
699,"The Order of Things: Hierarchies, Structures, and Pecking Orders","By Kuklin, Susan"," Young Adult Nonfiction , General",6.48,3.0
700,Dining with the Duchess: Making Everyday Meals a Special Occasion,"By York, Sarah Mountbatten-Windsor, Duchess of"," Cooking , Health & Healing , General",4.99,3.0
701,Introductory Linear Algebra With Applications,"By Kolman, Bernard and Hill, David R.",,7.0,3.0
702,The search for Peking man,"By Janus, Christopher G.",,5.29,3.0
703,Intimate Matters: A History of Sexuality in America,"By Freedman, Estelle B. and D'Emilio, John"," Social Science , Sociology , General",6.18,3.0
704,Hollywood vs. America: The Explosive Bestseller that Shows How-and Why-the Entertainment Industry Has Broken Faith With Its Audience,"By Medved, Michael"," Social Science , Popular Culture",5.29,3.0
705,Shaken Not Stirred,"By Miller, Anistatia R. and Brown, Jared M."," Cooking , Beverages , Bartending",4.99,3.0
706,Henry Adams,"By Blackmur, R. P",,5.88,3.0
707,A Hole in the Earth,"By Bausch, Robert"," Fiction , Sagas",6.07,3.0
708,You Say You Want a Revolution : A Story of Information Age Politics,"By Hundt, Reed E."," Political Science , Public Affairs & Administration",5.0,3.0
709,Kayaking: Whitewater and Touring Basics (A Trailside Guide),"By Krauzer, Steven M."," Sports & Recreation , Kayaking",5.29,3.0
710,My Country: The Story of Modern Israel,"By Eban, Abba Solomon",,10.99,3.0
711,Praying God's Will For Your Life: A Prayerful Walk To Spiritual Well Being,"By Omartian, Stormie"," Religion , Christian Living , Prayer",5.19,3.0
712,The Good Black,"By Barrett, Paul M."," Law , Discrimination",5.29,3.0
713,"An Inquiry Concerning Human Understanding: With a Supplement, An Abstract of a Treatise of Human Nature",By David Hume,,5.29,3.0
714,The Unfinished Constitution: Philosophy and Constitutional Practice,"By Arthur, John"," Social Science , General",10.99,3.0
715,"PARKER'S WINE BUYER'S GUIDE, 5TH EDITION : Complete, Easy-to-Use Reference on Recent Vintages, Prices, and Ratings for More Than 8,000 Wines from All the Major Wine Regions","By Parker, Robert M., Jr."," Cooking , Reference",9.89,3.0
716,Artificial Intelligence: How Machines Think,"By Peat, F. David",,5.95,3.0
717,Communications and Networking for the IBM PC and Compatibles,"By Jordan, Larry E",,6.6,3.0
718,The Macmillan Visual Desk Reference,By Diagram Group,,7.93,3.0
719,The standard wine cook book,"By Director, Anne",,4.99,3.0
720,"Tales Of Passion, Tales Of Woe","By Gulland, Sandra"," Fiction , Historical , General",5.29,3.0
721,Keeping Life Simple: 380 Tips & Ideas,"By Levine, Karen"," Self-help , Personal Growth , General",5.29,3.0
722,HOLLYWOOD HUSBANDS,"By Collins, Jackie"," Fiction , General",8.78,3.0
723,Raise Heaven and Earth: The Story of Martin Marietta People and Their Pioneering Achievements,"By Harwood, William B."," Business & Economics , General",8.79,3.0
724,"Learning disabilities, systemizing teaching and service delivery","By Sabatino, David A.,",,7.81,3.0
725,The Testament of Light,"By Bullett, Gerald",,4.99,3.0
726,The American Geriatrics Society's Complete Guide to Aging and Health: How We Age*Caring for Parents*Long-Term Care Choices*Wise Health Care Decisions* ... Care Financing*Analysis of Common Ailments,"By Williams, Mark E., M.D."," Health & Fitness , Health Care Issues",10.99,3.0
727,"Potter Needlework Library, The: Essentials of Sewing, Volume 2","By Patterson, Debbie (PHT), Thompson, Sue, and Coe, Miriam"," Crafts & Hobbies , Sewing",4.99,3.0
728,Julius Caesar (Cambridge School Shakespeare),"By Shakespeare, William and Seward, Tim (EDT)"," Literary Criticism , Ancient & Classical",5.29,3.0
729,Men and Angels,"By Ward, Theodora",,13.17,3.0
730,Debrett's book of royal children,"By Kidd, Charles and Montague-Smith, Patrick",,4.99,3.0
731,"Rock, Roll & Remember","By Clark, Dick",,30.77,3.0
732,"Inside the House: An irreverent guided tour through the House of Representatives, from the days of  Adam Clayton Powell to those of Peter Rodino","By Rapoport, Daniel",,7.64,3.0
733,Everyone's Money Book,"By Goodman, Jordan Elliot and Bloch, H. I. Sonny"," Business & Economics , Personal Finance , General",7.56,3.0
734,"The United Lutheran Church in America, 1918-1962","By Bachmann, E. Theodore, Bachmann, Mercia Brenne, and Rorem, Paul (EDT)"," Religion , Christianity , Lutheran",5.29,3.0
735,God's Psychiatry: Healing for the Troubled Heart and Spirit,"By Allen, Charles L."," Religion , Meditations",5.29,3.0
736,In the Shadow of F.D.R.: From Harry Truman to Bill Clinton,"By Leuchtenburg, William E."," Political Science , History & Theory",10.99,3.0
737,The Nominative Case,"By MacKin, Edward"," Fiction , Mystery & Detective , General",14.62,3.0
738,The Dannon Book of Yogurt,"By Stuart, Sandra Lee"," Cooking , General",5.29,3.0
739,TERRITORIES OF THE VOICE,"By Desalvo, Louise, D'Arcy, Kathleen Walsh, and Hogan, Katherine"," Fiction , General",4.99,3.0
740,The sports factory: An investigation into college sports,"By Durso, Joseph",,5.65,3.0
741,Intelligent Business Alliances: How to Profit Using Today's Most Important Strategic Tool,"By Segil, Larraine"," Business & Economics , Development , Business Development",5.29,3.0
742,Porterhouse Blue,"By Sharpe, Tom"," Fiction , Literary",4.99,3.0
743,Paradigms: The Business of Discovering the Future,"By Barker, Joel Arthur"," Business & Economics , General",4.99,3.0
744,Cushions & Covers: A Step-By-Step Guide to Creative Soft Furnishings (Reader's Digest: Practical Home Decorating),"By Moore, Gina"," Crafts & Hobbies , Decorating",10.99,3.0
745,We Interrupt This Broadcast: Relive the Events That Stopped Our Lives...from the Hindenburg to the Death of Princess Diana (book with 2 audio CDs),"By Garner, Joe"," Performing Arts , Radio , General",5.42,3.0
746,Changing Places: Rebuilding Community in the Age of Sprawl,"By Moe, Richard and Wilkie, Carter"," Social Science , Sociology , General",5.29,3.0
747,Anne Frank : The Biography,"By Kimber, Rita (TRN), Kimber, Robert (TRN), and Muller, Melissa"," Biography & Autobiography , Historical",4.99,3.0
748,Muhammad: The messenger of God,"By Kelen, Betty",,5.29,3.0
749,The Elegant Onion: The Art of Allium Cookery,"By Cavage, Betty"," Cooking , General",19.95,3.0
750,Awakening Corporate Soul: Four Paths to Unleash the Power of People at Work,"By Izzo, John B. and Klein, Eric"," Business & Economics , Leadership",4.99,3.0
751,"WW II Air War : The Men, the Machines, the Missions","By Sanfelici, Arthur H. (editor)",,6.2,3.0
752,The Puzzles of Amish Life (People's Place Book No. 10),"By Kraybill, Donald B."," Social Science , Ethnic Studies , General",4.99,3.0
753,A Reason For Hope: Gaining Strength for Your Fight Against Cancer,"By Barry, Michael S."," Religion , Christian Life , Devotional",4.99,3.0
754,Exploring the Labyrinth: Making Sense of the New Spirituality,"By Drury, Nevill"," Body, Mind & Spirit , New Thought",4.99,3.0
755,Ending the Homework Hassle,"By Rosemond, John"," Family & Relationships , General",4.99,3.0
756,The Race for the Triple Crown,"By Drape, Joe"," Sports & Recreation , Horse Racing",4.99,3.0
757,Lewis and Clark: Doctors in the Wilderness,"By Paton, Bruce C., M.D."," History , United States , 19th Century",4.99,3.0
758,The Best Intentions,"By Bergman, Ingmar and Tate, Joan (TRN)"," Fiction , Literary",4.99,3.0
759,OFFICIAL GUIDE TO THE SMITHSONIAN,"By Smithsonian Institution (COR) and Hirzy, Ellen Cochran (EDT)",,5.29,3.0
760,Dale Earnhardt: 1951-2001,"By Moriarty, Frank"," Sports & Recreation , Motor Sports",4.99,3.0
761,"The Insiders' Guide to Civil War Sites in the Eastern Theater, 2nd","By Gleason, Michael P."," Travel , United States , General",4.99,3.0
762,The Mayor of Central Park,"By Avi and Floca, Brian (ILT)"," Juvenile Fiction , Historical , United States , 20th Century",4.99,3.0
763,Diary of an Arctic Year,"By Krasemann, Stephen J."," Nature , General",7.3,3.0
764,Don't Give It Away! : A Workbook of Self-Awareness and Self-Affirmations for Young Women,"By Vanzant, Iyanla and Wilcots, Almasi"," Self-help , Affirmations",4.89,3.0
765,One Day My Soul Just Opened Up: 40 Days and 40 Nights Toward Spiritual Strength and Personal Growth,"By Vanzant, Iyanla"," Religion , Inspirational",4.99,3.0
766,St. John's Wort,"By Rosenthal, Norman"," Health & Fitness , Herbal Medications",4.99,3.0
767,Long Road to Freedom: The Advocate History of the Gay and Lesbian Movement (Stonewall Inn Editions),"By Thompson, Mark (EDT)"," Social Science , General",7.03,3.0
768,"Escape Your Shape: How to Work Out Smarter, Not Harder","By Jackowski, Edward J., Ph.D. and Jeffers, Youzell (ILT)"," Health & Fitness , Exercise , General",4.99,3.0
769,Pony Express Christmas,"By Brouwer, Sigmund"," Fiction , Religious",5.29,3.0
770,Christmas Decorations from Williamsburg's Folk Art Collection,By Abby Aldrich Rockefeller Folk Art Museum," House & Home , General",4.99,3.0
771,A Crafter's Book of Angels,"By Morgenthal, Deborah"," Crafts & Hobbies , General",5.29,3.0
772,Lockheed F-117A: Operation and Development of the Stealth Fighter,"By Sweetman, Bill and Goodall, James"," Political Science , General",5.29,3.0
773,Here: A Biography of the New American Continent,"By Depalma, Anthony"," Political Science , International Relations , General",5.81,3.0
774,Phonics (Step Ahead),"By Cole, Kathleen A."," Juvenile Nonfiction , Language Arts , General",4.99,3.0
775,The World of Silent Flight,"By WOLTERS, RICHARD A."," Technology & Engineering , General",6.0,3.0
776,Totline 1 2 3 Books ~ Simple Books To Make For Working With Young Children,"By Warren, Jean",,5.29,3.0
777,Songs from the Hills: An Intimate Look at Country Music,"By Von Matthiessen, Maria"," Music , Genres & Styles , Country & Bluegrass",10.99,3.0
778,Assessing Special Students: Strategies and Procedures,"By McLoughlin, J.A., Lewis, R.B.",,10.99,3.0
779,The transparent self,"By Jourard, Sidney M."," Psychology , General",5.29,3.0
780,Islands (Scientific American Library),"By Menard, H. W.",,10.99,3.0
781,The horn of plenty,"By Harvey, Peggy",,16.16,3.0
782,Home Away from Home,"By Woititz, Janet Geringer",,4.99,3.0
783,The Mammoth Cheese: A Novel,"By Holman, Sheri"," Fiction , Historical",4.99,3.0
784,"The Pearsall Guide to Successful Dog Training: Obedience ""from the Dog's Point of View""","By Pearsall, Margaret E."," Technology & Engineering , General",4.99,3.0
785,America-Watching: Perspectives in the Course of an Incredible Century,"By Johnson, Gerald White"," History , United States , General",5.95,3.0
786,"People Power: How to Create a Lifetime Network for Business, Career, and Personal Advancement","By Fisher, Donna"," Business & Economics , Careers , General",5.29,3.0
787,"Half Empty, Half Full: Understanding the Psychological Roots of Optimism","By Vaughan, Susan C."," Psychology , Emotions",5.29,3.0
788,The Sooners,"By Willoughby, Lee Davis"," Fiction , General",4.99,3.0
789,Finding Birds in the National Capital Area,"By Wiilds, Claudia"," Science , Life Sciences , Zoology , General",5.29,3.0
790,Decatur house and its inhabitants,"By Beale, Marie Oge",,5.67,3.0
791,Holy Siege: The Year That Shook Catholic America,"By Briggs, Kenneth A."," Religion , General",10.99,3.0
792,Guilty: The Collapse of Criminal Justice,"By Rothwax, Harold J."," Law , Criminal Law , General",4.99,3.0
793,Wings Like Eagles,By Paul A. Schweizer," Transportation , Aviation , History",5.0,3.0
794,Big Trouble: A Murder in a Small Western Town Sets Off a Struggle for the Soul of America,"By Lukas, J. Anthony"," History , United States , 20th Century",8.79,3.0
795,The Legal & Regulatory Environment of Business,"By Corley, Robert N. (EDT)"," Business & Economics , General",10.99,3.0
796,Life in a Medieval Castle,"By Gies, Joseph"," History , Europe , Medieval",4.99,3.0
797,Branch Rickey's Little Blue Book: Wit and Strategy from Baseball's Last Wise Man,"By Monteleone, John J. and Rickey, Branch"," Sports & Recreation , Baseball , History",5.29,3.0
798,Music Machines American Style; A Catalog of the Exhibition,"By Hoover, Cynthia A",,6.79,3.0
799,What Just Happened: A Chronicle from the Information Frontier,"By Gleick, James"," Computers , General",5.29,3.0
800,"If You Leave Me, Can I Come Too?","By Heimel, Cynthia"," Social Science , General",5.29,3.0
801,Mississippi Memories: Classic American Cooking from the Heartland to the Mississippi Bayou,"By Rodgers, Rick and Delta Queen Steamboat Co."," Cooking , General",5.41,3.0
802,Pioneering Ascents,"By Mazel, David (EDT)"," Sports & Recreation , Mountaineering",5.37,3.0
803,"Feed a Cold, Starve a Fever: A Dictionary of Medical Folklore","By Rinzler, Carol Ann"," Social Science , General",5.29,3.0
804,The Chiangs of China,By Elmer T. Clark,,15.4,3.0
805,"Antaeus: No. 69, Fall, 1992","By Halpern, Daniel (EDT)"," Poetry , American , General",4.99,3.0
806,The International Encyclopedia of Aviation,By Rh Value Publishing,,9.82,3.0
807,A companion guide to the Royal Castle in Warsaw,By Jerzy Lileyko,,5.29,3.0
808,The Dance of Anger: A Woman's Guide to Changing the Patterns of Intimate Relationships,"By Lerner, Harriet Goldhor"," Psychology , Interpersonal Relations",5.29,3.0
809,"Kasparov Vs. Karpov, 1990 (Cadogan Chess Books)","By Kasparov, Garry K."," Games , Chess",4.99,3.0
810,Wits and Sages,"By Grauer, Neil A.",,4.99,3.0
811,Training the Perfect Puppy: A New Owner's Guide,"By Prisco, Andrew De and De Prisco, Andrew"," Pets , Dogs , Breeds",4.99,3.0
812,Bubbles Ablaze,"By Strohmeyer, Sarah"," Fiction , Mystery & Detective , Women Sleuths",8.79,3.0
813,The Third Sister: A Continuation of Jane Austen's Sense and Sensibility,"By Barrett, Julia"," Fiction , General",4.99,3.0
814,Sociology: A Down-To-Earth Approach,"By Henslin, James M."," Social Science , Research",7.69,3.0
815,Breads: Step-by-Step Techniques,"By Ed, Sunset",,5.29,3.0
816,"Death Benefit: A Lawyer Uncovers a 20-year Pattern of Seduction, Arson and Murder","By Heilbroner, David and Keeney, Steven"," Social Science , General",5.64,3.0
817,Making War,"By Lehman, John"," Law , General",4.99,3.0
818,Beyond Survival: New Directions for the Disarmament Movement,"By Albert, Michael (EDT) and Dellinger, Dave (EDT)"," Political Science , International Relations , Arms Control",5.03,3.0
819,The Grand Tradition: British Art from Amherst College,"By Trapp, Frank",,4.99,3.0
820,Surprise Party,"By Katz, William"," Fiction , General",4.99,3.0
821,The Family Contract: A Blueprint for Successful Parenting,"By Leftin, Howard I.",,5.29,3.0
822,Real World Illustrator 8 (2nd Edition),"By McClelland, Deke and McClelland, Daniel"," Computers , Computer Graphics",8.93,3.0
823,Machine Embroidery (The Potter Needlework Library),"By Burgess, Linda (PHT), Carter, Clare, and Clare, Carter"," Crafts & Hobbies , Needlework , Embroidery",5.29,3.0
824,Dressed to Grill: Savvy Recipes for Girls Who Play with Fire,"By Morgan, Diane, Brooks, Karen, Darmon, Reed, and Adams, Beth (ILT)"," Cooking , Methods , Outdoor",5.29,3.0
825,Motherhood: The Second Oldest Profession,"By Bombeck, Erma"," Social Science , General",4.99,3.0
826,Shadow Money,"By Effinger, George Alec"," Fiction , General",32.95,3.0
827,The Book of the Month: Sixty Years of Books in American Life,"By Silverman, Al (EDT)"," Literary Criticism , General",4.99,3.0
828,"The New Grove Second Viennese School: Schoenberg, Webern, Berg","By Griffiths, Paul, Neighbour, Oliver, and Perle, George"," Music , Genres & Styles , Classical",5.29,3.0
829,F. Scott Fitzgerald (Literary Lives),"By Mizener, Arthur"," Biography & Autobiography , Literary",4.99,3.0
830,The Research Universities and Their Patrons,"By Rosenzweig, Robert M."," Social Science , Sociology , General",4.99,3.0
831,Sams' Teach Yourself Upgrading and Fixing PCs in 24 Hours (Teach Yourself in 24 Hours Series),"By Grimes, Galen"," Computers , Hardware , Personal Computers , PCs",5.39,3.0
832,8-Color Country Cross-Stitch,"By Stevenson, Sarah"," Crafts & Hobbies , Sewing",4.99,3.0
833,Living With Cannibals And Other Womens Adventures,"By Slung, Michele and Lindbergh, Reeve (INT)"," Travel , Special Interest , Adventure",5.29,3.0
834,A Time of Our Choosing: America's War in Iraq,"By Purdum, Todd S."," History , Military , Iraq War (2003-2011)",5.47,3.0
835,Rewriting History,"By Morris, Dick and McGann, Eileen"," Political Science , Political Process , General",10.75,3.0
836,A journey through Oz: The business leaders road map to tracking information technology assets,"By Jesse, Chris",,4.99,3.0
837,Girls! Girls! Girls!:  Essays on Women and Music,"By Cooper, Sarah (EDT)"," Social Science , Popular Culture",4.99,3.0
838,The Soul of Golf,"By Hallberg, William"," Sports & Recreation , Golf",4.99,3.0
839,Surviving Schizophrenia: A Family Manual,"By Torrey, E. Fuller",,5.29,3.0
840,Restoring Hope: Conversations on the Future of Black America,"By West, Cornel and Sealey, Kelvin Shawn"," Social Science , Ethnic Studies , African American Studies",5.29,3.0
841,Sidelines: Behind the Scenes of America's Favorite Sport,"By Higgs, Ben",,10.99,3.0
842,"Love Awaits: African-American Women Talk about Sex, Love, and Life","By Long, Courtney"," Social Science , LGBT Studies , Lesbian Studies",4.99,3.0
843,Italian Days,"By Harrison, Barbara Grizzuti"," Travel , Essays & Travelogues",5.64,3.0
844,A Romance of the Equator: The Best Fantasy Stories of Brian W. Aldiss,"By Aldiss, Brian Wilson"," Fiction , Science Fiction , General",29.29,3.0
845,China After Mao (Princeton Legacy Library),"By Barnett, A. Doak (EDT)"," History , General",4.99,3.0
846,Universal Foam: From Cappuccino to the Cosmos,"By Perkowitz, Sidney"," Science , Physics",5.29,3.0
847,The Leading Edge,"By Boyne, Walter J."," Transportation , Aviation , History",9.89,3.0
848,John Clancy's Christmas Cookbook,"By Clancy, John"," Cooking , General",5.29,3.0
849,Classics of Jewish Literature,"By Lieberman, Leo and Beringause, Arthur F."," Language Arts & Disciplines , Rhetoric",9.89,3.0
850,Star Attraction Bulletin Boards (Troll Teacher Ideas),"By Rutmand, Shereen Gertel"," Education , Teaching Methods & Materials , General",5.29,3.0
851,Vocabulary Development: Grade 6 (Basics First),By Vicky Shiotsu,,4.99,3.0
852,West With The Night,"By Markham, Beryl"," Technology & Engineering , Aeronautics & Astronautics",4.99,3.0
853,Student Success Secrets (Barron's Educational Series),"By Jensen, Eric and McPherson, Charles (ILT)",,5.29,3.0
854,Dragons Teeth,"By Young, John Robert"," Political Science , General",6.6,3.0
855,I Feel Great and You Will Too!: An Inspiring Journey of Success with Practical Tips on How to Score Big in Life,"By Cosby, Bill (FRW), Croce, Pat, and Lyon, Bill"," Business & Economics , Motivational",4.99,3.0
856,How Is My Second Grader Doing In School? What to Expect and How to Help,"By Raymer, Dottie, Jacobson, Jennifer, and Parent-Teacher Advisory Board (COR)"," Education , Testing & Measurement",5.29,3.0
857,How to Get a Business Loan,"By Mancuso, Joseph R."," Business & Economics , General",5.29,3.0
858,"Why Me?: Coping With Grief, Loss and Change","By Krauss, Pesach"," Religion , General",5.29,3.0
859,The Snake-stone,"By Doherty, Berlie",,5.29,3.0
860,Empowering Technology: Implementing a U.S. Strategy,"By Branscomb, Lewis M. (EDT)"," Technology & Engineering , Social Aspects",5.29,3.0
861,The Runaway: A Novel,"By Kay, Terry"," Fiction , African American , Historical",4.99,3.0
862,Remediating Reading Disabilities: Simple Things That Work,"By Cook, Jimmie"," Language Arts & Disciplines , General",7.49,3.0
863,The White-Flower-Farm garden book,"By Pettingill, Amos",,5.29,3.0
864,Sky Woman Falling,"By Mitchell, Kirk"," Fiction , Mystery & Detective , Hard-Boiled",5.29,3.0
865,Art of the Gold Rush,"By National Museum of American Art (U. S.) (COR), Driesbach, Janice Tolhurst, Jones, Harvey, Holland, Katherine Church, Oakland Museum (COR), and Crocker Art Museum (COR)"," Art , Folk & Outsider Art",4.99,3.0
866,The Birdcage Book: Antique Birdcages for Contemporary Collector,"By Garisto, Leslie"," Antiques & Collectibles , General",4.99,3.0
867,The Argument Culture: Moving from Debate to Dialogue,"By Tannen, Deborah"," Psychology , Interpersonal Relations",4.99,3.0
868,Lincoln and Slavery,"By Burchard, Peter"," Young Adult Fiction , Historical , United States , General",5.3,3.0
869,"Biology: Evolution, Diversity...",By Mader,,8.77,3.0
870,William Faulkner: First Encounters,"By Brooks, Cleanth"," Literary Criticism , American , General",4.99,3.0
871,Feminism and Psychoanalytic Theory,"By Chodorow, Nancy J."," Social Science , Feminism & Feminist Theory",5.29,3.0
872,Moral Freedom: The Search for Virtue in a World of Choice,"By Wolfe, Alan"," Philosophy , Ethics & Moral Philosophy",5.29,3.0
873,Western Junior League Cookbook,"By Seranne, Ann"," Cooking , Regional & Ethnic , American , Western States",5.08,3.0
874,Charles: The untold story,"By Benson, Ross",,5.54,3.0
875,Better Homes and Gardens Household Hints and Tips,By Better Homes and Gardens Books," House & Home , General",10.99,3.0
876,Some Times in America,"By Chancellor, Alexander"," Biography & Autobiography , Literary",4.99,3.0
877,Christmas Treasures: Christmas Cookies,"By Hale, Gloria (EDT)"," Cooking , Courses & Dishes , Cookies",4.99,3.0
878,The Perfect Christmas,"By Magruder, Anne (EDT)"," Cooking , Holiday",5.29,3.0
879,"Making Cents: Every Kid's Guide to Money : How to Make It, What to Do With It","By Wilkinson, Elizabeth"," Juvenile Nonfiction , General",5.29,3.0
880,Phonics 2: Sound Patterns : Preschool and K (Brighter Child),"By American Education Publishing, American",,5.29,3.0
